{
  "$schema": "https://json-schema.org/draft/2020-12/schema",
  "$id": "https://github.com/dannroda/scope-compass/schema/task.schema.json",
  "title": "Task",
  "description": "Una tarea del tablero. El nombre del archivo (sin .json) es su id.",
  "type": "object",
  "required": [
    "milestone",
    "title",
    "status"
  ],
  "additionalProperties": false,
  "properties": {
    "milestone": {
      "type": "string",
      "description": "Id del hito, p. ej. m00"
    },
    "code": {
      "type": "string",
      "description": "Código visible, p. ej. 0.3. Puede estar vacío."
    },
    "order": {
      "type": "number",
      "description": "Orden dentro de la columna"
    },
    "title": {
      "type": "string",
      "minLength": 1
    },
    "status": {
      "enum": [
        "todo",
        "doing",
        "review",
        "done"
      ]
    },
    "checklist": {
      "type": "array",
      "items": {
        "type": "object",
        "required": [
          "text",
          "done"
        ],
        "additionalProperties": false,
        "properties": {
          "text": {
            "type": "string",
            "description": "Texto corto del paso (una línea)"
          },
          "done": {
            "type": "boolean"
          },
          "detail": {
            "type": "string",
            "description": "Detalle opcional del paso: el cómo, el porqué, archivos o código. Se muestra plegado debajo del texto."
          }
        }
      }
    },
    "due": {
      "type": "string",
      "pattern": "^\\d{4}-(0[1-9]|1[0-2])-(0[1-9]|[12]\\d|3[01])(T([01]\\d|2[0-3]):[0-5]\\d)?$",
      "description": "Fecha límite opcional: YYYY-MM-DD, o YYYY-MM-DDTHH:MM en hora local"
    },
    "priority": {
      "enum": [
        "high",
        "medium",
        "low"
      ],
      "description": "Prioridad opcional. Sin el campo, la tarea no tiene prioridad."
    },
    "assignee": {
      "type": "string",
      "minLength": 1,
      "description": "Responsable opcional: quién la tiene (una persona o un agente), texto libre"
    },
    "tags": {
      "type": "array",
      "description": "Etiquetas opcionales para filtrar (arte, audio, bug…): texto corto, sin comas ni espacios en los bordes, sin repetir",
      "uniqueItems": true,
      "items": {
        "type": "string",
        "minLength": 1,
        "maxLength": 40,
        "pattern": "^[^,\\s]([^,]*[^,\\s])?$"
      }
    },
    "test": {
      "type": "string",
      "description": "Cómo probarlo"
    },
    "notes": {
      "type": "string"
    },
    "refs": {
      "type": "array",
      "description": "Referencias a documentos: doc = ruta, section = id del comentario <!-- id: ... -->; sin section, el documento entero",
      "items": {
        "type": "object",
        "required": [
          "doc"
        ],
        "additionalProperties": false,
        "properties": {
          "doc": {
            "type": "string"
          },
          "section": {
            "type": "string"
          }
        }
      }
    },
    "links": {
      "type": "array",
      "description": "Vínculos con otras tareas: type = blocks (esta tarea bloquea a task) o related; task = id de la otra tarea. El inverso (bloqueada por) no se guarda.",
      "items": {
        "type": "object",
        "required": [
          "type",
          "task"
        ],
        "additionalProperties": false,
        "properties": {
          "type": {
            "enum": [
              "blocks",
              "related"
            ]
          },
          "task": {
            "type": "string",
            "minLength": 1
          }
        }
      }
    },
    "created_at": {
      "type": "string",
      "format": "date-time"
    },
    "updated_at": {
      "type": "string",
      "format": "date-time"
    }
  }
}
