{
  "checklist": [
    {
      "detail": "Una entrada en VARIANTS (epiphany_palette.py) para el P2: otra tela y otro neón, como los Links de colores de Four Swords.",
      "done": false,
      "text": "Variante de paleta"
    },
    {
      "detail": "Que la cota reforzada también tenga su versión P2.",
      "done": false,
      "text": "Combinar con las armaduras"
    }
  ],
  "code": "13.6",
  "created_at": "2026-10-10T05:37:20.788Z",
  "milestone": "m13",
  "notes": "Skills: `disciplines:create-game-assets`.",
  "order": 6,
  "priority": "medium",
  "refs": [
    {
      "doc": "gdd.md",
      "section": "fuera-mvp"
    }
  ],
  "status": "todo",
  "tags": [
    "coop",
    "arte"
  ],
  "test": "P1 y P2 se distinguen de un vistazo con cualquier armadura.",
  "title": "Player 2 con su color",
  "updated_at": "2026-10-10T05:37:21.831Z"
}
