{
  "checklist": [
    {
      "detail": "Ya existe en `TopDownCamera`; limitar cuánto se aleja del player para que no salga de pantalla.",
      "done": false,
      "text": "Revisar el punto medio con lock-on"
    },
    {
      "detail": "Desplazar el foco unos metros mientras se apunta un ítem a distancia, con suavizado.",
      "done": false,
      "text": "Look-ahead hacia la dirección de `Aim`"
    },
    {
      "detail": "Para ajustarlos jugando; dejar un watch en el overlay.",
      "done": false,
      "text": "Exportar los valores de suavizado"
    }
  ],
  "code": "2.4",
  "created_at": "2026-10-08T04:45:07.668Z",
  "milestone": "m02",
  "notes": "La cámara de salas (clamp y transición) es M6.\n\nSkills: `disciplines:camera-systems`.",
  "order": 4,
  "refs": [
    {
      "doc": "gdd.md",
      "section": "camara"
    }
  ],
  "status": "todo",
  "test": "Fijar un enemigo lejano: ambos quedan en pantalla. Apuntar con el arco (o con el modo debug de la retícula): la cámara se adelanta y vuelve suave al soltar.",
  "title": "Encuadre de cámara con lock-on y apuntado",
  "updated_at": "2026-10-08T04:45:07.932Z"
}
