{
  "checklist": [
    {
      "detail": "Difícil: más daño y menos drops. Contrarreloj: tiempo total al final.",
      "done": false,
      "text": "Elegir uno"
    },
    {
      "done": false,
      "text": "Desbloquear al terminar"
    }
  ],
  "code": "11.32",
  "created_at": "2026-10-10T05:29:47.718Z",
  "milestone": "m11",
  "notes": "",
  "order": 32,
  "priority": "low",
  "refs": [],
  "status": "todo",
  "tags": [
    "rejugabilidad"
  ],
  "test": "Tras los créditos aparece la opción; una partida en ese modo cambia lo prometido.",
  "title": "Modo difícil o contrarreloj",
  "updated_at": "2026-10-10T05:29:48.535Z"
}
