{
  "checklist": [
    {
      "detail": "Piedra tallada, fogata o similar.",
      "done": true,
      "text": "Hito del claro del inicio"
    },
    {
      "detail": "Para la cueva de las bombas y la gruta oculta.",
      "done": true,
      "text": "Kit de cueva: boca, piso y pared de roca, estalagmitas"
    },
    {
      "detail": "Ladrillo gris con musgo, que no se confunda con el acantilado. cracked_wall.tscn.",
      "done": true,
      "text": "Muro agrietado de exterior + escombros"
    },
    {
      "done": true,
      "text": "Kit de santuario: piso, paredes, columnas, pedestal"
    },
    {
      "detail": "src/world/light/.",
      "done": true,
      "text": "Puzzle de luz: fuente, espejo fijo 45°, cristal receptor"
    },
    {
      "detail": "gate.tscn, push_block.tscn, floor_switch.tscn.",
      "done": true,
      "text": "Reja, bloque empujable e interruptor de piso de exterior"
    },
    {
      "detail": "La pieza más importante del overworld.",
      "done": true,
      "text": "Entrada del templo: fachada, escalinata, columnas"
    },
    {
      "detail": "temple_seal.tscn.",
      "done": true,
      "text": "Sello violeta con el ojo"
    },
    {
      "detail": "eye_switch.tscn, bridge.tscn.",
      "done": false,
      "text": "Risco del ojo: cornisa, ojo-interruptor, puente, nicho del carcaj"
    },
    {
      "detail": "warp_portal.tscn. Opcional.",
      "done": true,
      "text": "Portal de salida del jefe: disco y anillo"
    }
  ],
  "code": "12.3",
  "created_at": "2026-10-09T21:05:30.742Z",
  "links": [
    {
      "task": "m11-04",
      "type": "related"
    }
  ],
  "milestone": "m12",
  "notes": "",
  "order": 3,
  "priority": "high",
  "refs": [
    {
      "doc": "gdd.md",
      "section": "overworld-layout"
    }
  ],
  "status": "doing",
  "tags": [
    "arte",
    "puzzles"
  ],
  "test": "Cada zona de [[gdd#overworld-layout]] tiene sus piezas propias y se reconoce sin el nombre de zona.",
  "title": "Lugares del overworld",
  "updated_at": "2026-10-11T05:37:37.438Z"
}
