{
  "checklist": [
    {
      "detail": "Mismos nombres de huesos que el Rig_Medium de KayKit, para no perder las animaciones.",
      "done": false,
      "text": "Player"
    },
    {
      "done": false,
      "text": "Esqueleto"
    },
    {
      "done": false,
      "text": "Esqueleto con escudo"
    },
    {
      "detail": "El rig de la otra jam no está en el repo. Ver [[gdd#jefe]].",
      "done": false,
      "text": "Jefe: ojo + dos manos con rig propio"
    }
  ],
  "code": "12.8",
  "created_at": "2026-10-09T21:05:44.538Z",
  "milestone": "m12",
  "notes": "",
  "order": 8,
  "priority": "low",
  "refs": [],
  "status": "todo",
  "tags": [
    "arte",
    "personajes"
  ],
  "test": "Los modelos nuevos usan las animaciones de player/animation/libs/ sin retarget.",
  "title": "Personajes propios",
  "updated_at": "2026-10-09T21:05:45.820Z"
}
