{
  "checklist": [
    {
      "detail": "Los ladrillos de la pared propia sobresalen ~7 cm de la celda; el corte empezaba 5 cm dentro de la sala y quedaba una lámina de 2 cm a toda altura.",
      "done": true,
      "text": "Encontrar qué dibuja las franjas"
    },
    {
      "detail": "TopDownCamera.SOUTH_WALL_RELIEF; test test_south_wall_cut_covers_the_brick_relief.",
      "done": true,
      "text": "Empezar el corte 0.3 m dentro de la sala"
    }
  ],
  "code": "11.18",
  "created_at": "2026-10-10T02:17:05.422Z",
  "milestone": "m11",
  "notes": "",
  "order": 18,
  "priority": "high",
  "refs": [],
  "status": "done",
  "tags": [
    "bug",
    "camara"
  ],
  "test": "En cualquier sala del templo, la pared sur queda como un zócalo bajo, sin franjas ni sombras de ladrillos, y la puerta sur se ve.",
  "title": "Pared sur del templo: lámina de ladrillos sin colisión tapando la puerta sur",
  "updated_at": "2026-10-10T02:17:06.988Z"
}
