{
  "checklist": [
    {
      "detail": "Zumbido mecánico de fondo, chirrido de párpados, carga del orbe, rugido de fase, golpes con más grave.",
      "done": false,
      "text": "Voz propia"
    },
    {
      "detail": "Reemplazar el placeholder (Music.boss_fight) por un tema propio, con capas por fase.",
      "done": false,
      "text": "Tema de música"
    }
  ],
  "code": "11.47",
  "created_at": "2026-10-10T23:12:51.056Z",
  "links": [
    {
      "task": "m11-46",
      "type": "related"
    }
  ],
  "milestone": "m11",
  "notes": "Skills: `disciplines:audio-design`, `godot:godot-audio`.",
  "order": 50,
  "priority": "low",
  "refs": [
    {
      "doc": "gdd.md",
      "section": "jefe"
    }
  ],
  "status": "todo",
  "tags": [
    "jefe",
    "audio"
  ],
  "test": "La pelea tiene sonido propio y la música cambia con las fases.",
  "title": "Audio del jefe",
  "updated_at": "2026-10-10T23:12:53.212Z"
}
