{
  "checklist": [
    {
      "detail": "Reusar el encuadre del lock-on: la cámara mantiene a ambos; si se alejan demasiado, un borde invisible los frena.",
      "done": true,
      "text": "Encuadre de los dos"
    },
    {
      "detail": "Estilo Four Swords: al cruzar uno la puerta, el otro es llevado con él (o hace falta que estén los dos). Decidir y anotar.",
      "done": true,
      "text": "Cambio de sala"
    },
    {
      "detail": "Overworld ↔ templo llevan a los dos al spawn.",
      "done": true,
      "text": "Escenas"
    }
  ],
  "code": "13.3",
  "created_at": "2026-10-10T05:37:16.045Z",
  "links": [
    {
      "task": "m14-03",
      "type": "blocks"
    }
  ],
  "milestone": "m13",
  "notes": "Skills: `godot:godot-nodes-scenes`, `disciplines:input-systems`, `disciplines:camera-systems`.",
  "order": 3,
  "priority": "high",
  "refs": [
    {
      "doc": "gdd.md",
      "section": "fuera-mvp"
    }
  ],
  "status": "review",
  "tags": [
    "coop",
    "camara"
  ],
  "test": "Recorrer el templo de punta a punta con dos players: nunca queda uno fuera de cuadro ni en otra sala.",
  "title": "Cámara y salas para dos",
  "updated_at": "2026-10-11T06:23:20.333Z"
}
