{
  "checklist": [
    {
      "detail": "`src/components/interactable.gd` y un `Area3D` en el player que elige el más cercano de frente al apretar `interact`. El prompt en pantalla es 4.1.",
      "done": false,
      "text": "Crear `Interactable` e `InteractionDetector` mínimos"
    },
    {
      "detail": "Chico y grande; se abre una sola vez gracias a su `flag`. Código en [[gdd#mundo]].",
      "done": false,
      "text": "Crear `src/world/chest.gd` y `chest.tscn`"
    },
    {
      "detail": "Enruta llaves, mapa, brújula, contenedores y el resto al inventario. Ver [[gdd#estado-flags]].",
      "done": false,
      "text": "`GameState.give()` como entrada única"
    },
    {
      "detail": "Animación `PickUp`/`Use_Item` con el ítem en alto, nombre y descripción en una caja simple; el mundo en pausa hasta confirmar. La caja de texto completa llega en 4.2.",
      "done": false,
      "text": "Estado `ItemGet`"
    },
    {
      "detail": "Si el ítem es equipo y la ranura está vacía, se equipa. Si es usable y hay un botón libre, se asigna.",
      "done": false,
      "text": "Primer equipado automático"
    }
  ],
  "code": "3.6",
  "created_at": "2026-10-08T04:45:10.677Z",
  "links": [
    {
      "task": "m4-01",
      "type": "blocks"
    },
    {
      "task": "m6-03",
      "type": "blocks"
    }
  ],
  "milestone": "m03",
  "notes": "",
  "order": 6,
  "refs": [
    {
      "doc": "gdd.md",
      "section": "mundo"
    },
    {
      "doc": "gdd.md",
      "section": "estado-flags"
    }
  ],
  "status": "todo",
  "test": "Abrir un cofre con bombas: animación, texto y bombas en el inventario. Salir y volver a la escena (o guardar y cargar): el cofre sigue abierto y no da bombas de nuevo.",
  "title": "Cofres e item get",
  "updated_at": "2026-10-08T04:46:16.477Z"
}
