{
  "checklist": [
    {
      "detail": "Un recurso con `id`, `description` y `default_value` (una flag declarada). Si Godot no deja exportar `default_value` como `Variant`, usar `bool` por ahora: casi todas las flags son sí o no.",
      "done": false,
      "text": "Crear `src/state/flag_definition.gd`"
    },
    {
      "detail": "El recurso `FlagRegistry`, con la lista de definiciones y las funciones `has()` y `default_of()`. Código en [[gdd#estado-flags]].",
      "done": false,
      "text": "Crear `src/state/flag_registry.gd`"
    },
    {
      "detail": "Con el nivel de prueba alcanza una de ejemplo: `ow_test_chest`.",
      "done": false,
      "text": "Crear `data/flag_registry.tres` con las flags de hoy"
    }
  ],
  "code": "0.4",
  "created_at": "2026-09-29T18:00:00Z",
  "links": [
    {
      "task": "m0-05",
      "type": "blocks"
    }
  ],
  "milestone": "m00",
  "notes": "Las flags son el estado del mundo que se guarda: un cofre abierto, una puerta destrabada. Se declaran en un registro para evitar errores de tipeo y para que el Save Inspector pueda avisar cuando una partida tiene una flag que no existe. Diseño en el GDD (§11.6).",
  "order": 4,
  "refs": [
    {
      "doc": "gdd.md",
      "section": "estado-flags"
    }
  ],
  "status": "todo",
  "test": "`load(\"res://data/flag_registry.tres\").has(&\"ow_test_chest\")` devuelve `true`, y con cualquier otro id devuelve `false`.",
  "title": "Flags",
  "updated_at": "2026-10-04T22:17:17.654Z"
}
