{
  "checklist": [
    {
      "detail": "Límites de cámara que encuadran toda la arena; puerta que se cierra al entrar.",
      "done": true,
      "text": "Sala del jefe con `Room`"
    },
    {
      "detail": "Cámara al ojo, nombre en pantalla, música (placeholder).",
      "done": true,
      "text": "Intro corta"
    },
    {
      "detail": "Escucha el `Health` del jefe; aparece en la intro y se va al morir.",
      "done": true,
      "text": "Barra de vida del jefe en el HUD"
    }
  ],
  "code": "9.2",
  "created_at": "2026-10-08T04:45:30.850Z",
  "links": [
    {
      "task": "m9-04",
      "type": "blocks"
    }
  ],
  "milestone": "m09",
  "notes": "",
  "order": 2,
  "refs": [
    {
      "doc": "gdd.md",
      "section": "jefe"
    },
    {
      "doc": "gdd.md",
      "section": "ui"
    }
  ],
  "status": "done",
  "test": "Entrar a la arena: la puerta se cierra, la intro se puede saltar y la barra baja al pegarle.",
  "title": "Arena del jefe y barra de vida",
  "updated_at": "2026-10-10T03:17:32.509Z"
}
