{
  "checklist": [
    {
      "detail": "Variante del esqueleto con escudo equipado.",
      "done": false,
      "text": "`EntityConfig` y escena"
    },
    {
      "detail": "Reutilizar la lógica de cono de 1.2 en el `_on_hurtbox_hit` del enemigo.",
      "done": false,
      "text": "Bloquea de frente"
    },
    {
      "detail": "El golpe de escudo le baja la guardia un momento.",
      "done": false,
      "text": "Vulnerable de flanco, a bombas y al golpe de escudo"
    },
    {
      "detail": "Más lento que el esqueleto común; no puede girar rápido.",
      "done": false,
      "text": "BT: avanza con guardia y gira hacia el player"
    }
  ],
  "code": "8.2",
  "created_at": "2026-10-08T04:45:26.798Z",
  "links": [
    {
      "task": "m8-05",
      "type": "blocks"
    }
  ],
  "milestone": "m08",
  "notes": "Skills: `disciplines:ai-behavior-trees-utility-ai`, `disciplines:game-ai`.",
  "order": 2,
  "refs": [
    {
      "doc": "gdd.md",
      "section": "combate"
    }
  ],
  "status": "todo",
  "test": "Pegarle de frente no hace daño; rodar a su espalda, una bomba o un golpe de escudo y luego espada, sí.",
  "title": "Esqueleto con escudo",
  "updated_at": "2026-10-08T04:45:58.978Z"
}
