{
  "checklist": [
    {
      "detail": "`Area3D` con `room_index`, `camera_limits` y `display_name`. Código en [[gdd#mundo]].",
      "done": false,
      "text": "Crear `src/world/room.gd`"
    },
    {
      "detail": "`TopDownCamera.room`: `null` = overworld. Dibujar los límites en el editor (`@tool`) para ajustarlos.",
      "done": false,
      "text": "Cámara clampeada a la sala"
    },
    {
      "detail": "Input bloqueado, el player camina solo por la puerta (estado `Transition`) y la cámara se desliza ≈0.5 s.",
      "done": false,
      "text": "Transición al cambiar de sala"
    },
    {
      "detail": "`DungeonState.visit()`; el HUD muestra `display_name` al entrar por primera vez.",
      "done": false,
      "text": "Marcar sala visitada y nombre en pantalla"
    },
    {
      "detail": "Al morir en mazmorra, en lugar del spawn del nivel ([[gdd#combate]]).",
      "done": false,
      "text": "Reaparecer en la entrada de la sala"
    }
  ],
  "code": "6.1",
  "created_at": "2026-10-08T04:45:18.720Z",
  "links": [
    {
      "task": "m6-02",
      "type": "blocks"
    },
    {
      "task": "m6-04",
      "type": "blocks"
    },
    {
      "task": "m6-06",
      "type": "blocks"
    },
    {
      "task": "m9-02",
      "type": "blocks"
    }
  ],
  "milestone": "m06",
  "notes": "Skills: `disciplines:camera-systems`, `godot:godot-3d-essentials`.",
  "order": 1,
  "refs": [
    {
      "doc": "gdd.md",
      "section": "mundo"
    },
    {
      "doc": "gdd.md",
      "section": "camara"
    }
  ],
  "status": "todo",
  "test": "Dos salas pegadas: al cruzar, la cámara se desliza y queda dentro de los límites de la nueva; la cámara nunca muestra fuera de la sala.",
  "title": "`Room` y cámara por sala",
  "updated_at": "2026-10-08T04:46:01.519Z"
}
