{
  "checklist": [
    {
      "detail": "Las dos manos en alto con el objeto (como Carry, con IK horneado en build_carry_anims.py o un script hermano); entrada y salida cortas.",
      "done": false,
      "text": "Animación"
    },
    {
      "detail": "La caja de item get muestra al player en la pose con el objeto arriba y un destello; sonido propio.",
      "done": false,
      "text": "Integración"
    }
  ],
  "code": "11.48",
  "created_at": "2026-10-10T23:12:48.454Z",
  "milestone": "m11",
  "notes": "Skills: `godot:godot-animation`, `disciplines:game-feel`.",
  "order": 48,
  "priority": "medium",
  "refs": [],
  "status": "todo",
  "tags": [
    "personajes",
    "feel"
  ],
  "test": "Abrir un cofre grande: el player levanta el ítem con las dos manos, se ve el objeto arriba y vuelve a su pose al cerrar la caja.",
  "title": "Pose de item get",
  "updated_at": "2026-10-10T23:13:28.159Z"
}
